{
  "$schema": "http://json-schema.org/draft-07/schema#",
  "$id": "https://scalang.codeparth.dev/api/schema",
  "$comment": "Hosted: https://scalang.codeparth.dev/api/schema | Local: \"./node_modules/@scalang/schema/schema.json\"",
  "title": "Scalang Configuration",
  "description": "Configuration for Scalang CLI — template generation, verification, and localization.",
  "type": "object",
  "required": [
    "source",
    "sourceLocale",
    "targetLocales",
    "defaultLocale",
    "translatableFields"
  ],
  "properties": {
    "$schema": {
      "type": "string",
      "description": "JSON Schema reference. Hosted: https://scalang.codeparth.dev/api/schema | Local: ./node_modules/@scalang/schema/schema.json"
    },
    "source": {
      "type": "string",
      "description": "Path to the source OpenAPI spec file (relative to project root)",
      "examples": ["./specs/openapi.json", "./openapi.yaml"]
    },
    "outputDir": {
      "type": "string",
      "default": "public/specs",
      "description": "Output directory for generated per-language specs"
    },
    "sourceLocale": {
      "$ref": "#/definitions/localeCode",
      "description": "Base/source language. BCP 47 locale code compatible with @lingo.dev/_spec and @lingo.dev/_locales (e.g. en, en-US, zh-Hans-CN)."
    },
    "targetLocales": {
      "type": "array",
      "items": { "$ref": "#/definitions/localeCode" },
      "description": "Target languages to translate into. BCP 47 locale codes compatible with @lingo.dev/_locales."
    },
    "defaultLocale": {
      "$ref": "#/definitions/localeCode",
      "description": "Default language for the root redirect. BCP 47 locale code compatible with @lingo.dev/_locales."
    },
    "translatableFields": {
      "type": "array",
      "items": {
        "type": "object",
        "required": ["name", "enabled", "fields"],
        "properties": {
          "name": { "type": "string" },
          "enabled": { "type": "boolean" },
          "fields": {
            "type": "array",
            "items": { "type": "string" }
          }
        },
        "additionalProperties": false
      }
    },
    "scalar": {
      "type": "object",
      "description": "Scalar API Reference configuration. Aligned with @scalar/types/api-reference apiReferenceConfigurationSchema.",
      "properties": {
        "title": { "type": "string", "description": "API title" },
        "slug": { "type": "string", "description": "URL slug" },
        "baseServerURL": { "type": "string", "description": "Base server URL" },
        "hideClientButton": { "type": "boolean", "default": false },
        "proxyUrl": { "type": "string", "description": "Request proxy URL" },
        "searchHotKey": {
          "type": "string",
          "enum": [
            "a",
            "b",
            "c",
            "d",
            "e",
            "f",
            "g",
            "h",
            "i",
            "j",
            "k",
            "l",
            "m",
            "n",
            "o",
            "p",
            "q",
            "r",
            "s",
            "t",
            "u",
            "v",
            "w",
            "x",
            "y",
            "z"
          ],
          "description": "Keyboard shortcut for search"
        },
        "showSidebar": { "type": "boolean", "default": true },
        "showDeveloperTools": {
          "type": "string",
          "enum": ["never", "always", "localhost"],
          "default": "localhost",
          "description": "When to show developer tools"
        },
        "operationTitleSource": {
          "type": "string",
          "enum": ["summary", "path"],
          "default": "summary",
          "description": "Source for operation titles"
        },
        "theme": {
          "type": "string",
          "enum": [
            "alternate",
            "default",
            "moon",
            "purple",
            "solarized",
            "bluePlanet",
            "deepSpace",
            "saturn",
            "kepler",
            "elysiajs",
            "fastify",
            "mars",
            "laserwave",
            "none"
          ],
          "default": "default",
          "description": "Scalar theme name"
        },
        "layout": {
          "type": "string",
          "enum": ["modern", "classic"],
          "default": "modern",
          "description": "Layout style"
        },
        "persistAuth": { "type": "boolean", "default": true },
        "telemetry": { "type": "boolean", "default": true },
        "hideModels": { "type": "boolean", "default": false },
        "documentDownloadType": {
          "type": "string",
          "enum": ["none", "yaml", "json", "both", "direct"],
          "default": "both",
          "description": "Document download options"
        },
        "hideDownloadButton": { "type": "boolean" },
        "hideTestRequestButton": { "type": "boolean", "default": false },
        "hideSearch": { "type": "boolean", "default": false },
        "showOperationId": { "type": "boolean", "default": false },
        "darkMode": { "type": "boolean", "default": false },
        "forceDarkModeState": {
          "type": "string",
          "enum": ["dark", "light"],
          "description": "Force dark or light mode"
        },
        "hideDarkModeToggle": { "type": "boolean", "default": false },
        "favicon": { "type": "string", "description": "Favicon URL" },
        "customCss": {
          "type": "string",
          "description": "Custom CSS to inject"
        },
        "withDefaultFonts": { "type": "boolean", "default": true },
        "defaultOpenFirstTag": { "type": "boolean", "default": false },
        "defaultOpenAllTags": { "type": "boolean", "default": false },
        "expandAllModelSections": { "type": "boolean", "default": false },
        "expandAllResponses": { "type": "boolean", "default": false },
        "tagsSorter": {
          "type": "string",
          "enum": ["alpha"],
          "description": "Sort tags alphabetically"
        },
        "operationsSorter": {
          "type": "string",
          "enum": ["alpha", "method"],
          "description": "Sort operations"
        },
        "orderSchemaPropertiesBy": {
          "type": "string",
          "enum": ["alpha", "preserve"],
          "default": "preserve",
          "description": "Order schema properties"
        },
        "orderRequiredPropertiesFirst": { "type": "boolean", "default": false }
      },
      "additionalProperties": false
    },
    "lingo": {
      "type": "object",
      "description": "Lingo.dev SDK options for OpenAPI translation. Locale fields use @lingo.dev/_spec format.",
      "properties": {
        "batchSize": {
          "type": "integer",
          "minimum": 1,
          "maximum": 250,
          "default": 100
        },
        "idealBatchItemSize": {
          "type": "integer",
          "minimum": 1,
          "maximum": 2500,
          "default": 1000
        },
        "fast": { "type": "boolean", "default": false }
      },
      "additionalProperties": false
    }
  },
  "additionalProperties": false,
  "definitions": {
    "localeCode": {
      "type": "string",
      "description": "BCP 47 locale code supported by @lingo.dev/_spec and @lingo.dev/_locales.",
      "enum": [
        "af",
        "af-ZA",
        "ar",
        "ar-AE",
        "ar-EG",
        "ar-MA",
        "ar-SA",
        "az",
        "az-AZ",
        "bar",
        "bar-DE",
        "be",
        "be-BY",
        "bg",
        "bg-BG",
        "bn",
        "bn-BD",
        "bn-IN",
        "ca",
        "ca-ES",
        "cs",
        "cs-CZ",
        "cy",
        "cy-GB",
        "da",
        "da-DK",
        "de",
        "de-AT",
        "de-CH",
        "de-DE",
        "el",
        "el-CY",
        "el-GR",
        "en",
        "en-AU",
        "en-CA",
        "en-GB",
        "en-IE",
        "en-SG",
        "en-US",
        "es",
        "es-419",
        "es-AR",
        "es-ES",
        "es-MX",
        "et",
        "et-EE",
        "eu",
        "eu-ES",
        "fa",
        "fa-IR",
        "fi",
        "fi-FI",
        "fil",
        "fil-PH",
        "fr",
        "fr-BE",
        "fr-CA",
        "fr-FR",
        "fr-LU",
        "ga",
        "ga-IE",
        "gl",
        "gl-ES",
        "he",
        "he-IL",
        "hi",
        "hi-IN",
        "hr",
        "hr-HR",
        "hu",
        "hu-HU",
        "hy",
        "hy-AM",
        "id",
        "id-ID",
        "is",
        "is-IS",
        "it",
        "it-CH",
        "it-IT",
        "iw",
        "iw-IL",
        "ja",
        "ja-JP",
        "ka",
        "ka-GE",
        "kk",
        "kk-KZ",
        "km",
        "km-KH",
        "ko",
        "ko-KR",
        "lt",
        "lt-LT",
        "lv",
        "lv-LV",
        "mk",
        "mk-MK",
        "ml",
        "ml-IN",
        "ms",
        "ms-MY",
        "mt",
        "mt-MT",
        "nap",
        "nap-IT",
        "nb-NO",
        "nl",
        "nl-BE",
        "nl-NL",
        "nn-NO",
        "no",
        "no-NO",
        "pa",
        "pa-IN",
        "pa-PK",
        "pl",
        "pl-PL",
        "pt",
        "pt-BR",
        "pt-PT",
        "ro",
        "ro-RO",
        "ru",
        "ru-BY",
        "ru-RU",
        "rw",
        "rw-RW",
        "sk",
        "sk-SK",
        "sl",
        "sl-SI",
        "so",
        "so-SO",
        "sq",
        "sq-AL",
        "sr",
        "sr-Cyrl-RS",
        "sr-Latn-RS",
        "sr-RS",
        "sv",
        "sv-SE",
        "sw",
        "sw-CD",
        "sw-KE",
        "sw-RW",
        "sw-TZ",
        "sw-UG",
        "ta",
        "ta-IN",
        "ta-SG",
        "te",
        "te-IN",
        "th",
        "th-TH",
        "ti",
        "ti-ET",
        "tl",
        "tl-PH",
        "tr",
        "tr-TR",
        "uk",
        "uk-UA",
        "ur",
        "ur-PK",
        "uz",
        "uz-Latn",
        "vi",
        "vi-VN",
        "zgh",
        "zgh-MA",
        "zh",
        "zh-CN",
        "zh-HK",
        "zh-Hans",
        "zh-Hans-CN",
        "zh-Hans-HK",
        "zh-Hans-TW",
        "zh-Hant",
        "zh-Hant-CN",
        "zh-Hant-HK",
        "zh-Hant-TW",
        "zh-SG",
        "zh-TW"
      ]
    }
  }
}
